{
  "$schema": "https://json-schema.org/draft/2020-12/schema",
  "$id": "toolkit.programme-binding.v1",
  "title": "Programme binding (.github/toolkit-programme.json)",
  "description": "Non-secret binding in a governed repository: the parent issue, record prefixes, the private state store and the checks that count as required. Repository identity comes from the origin remote and GitHub; this file must agree and cannot override it.",
  "type": "object",
  "additionalProperties": false,
  "required": ["schema", "repository", "parent_issue", "record_prefix", "writer_prefix", "store", "required_checks"],
  "properties": {
    "schema": { "const": "toolkit.programme-binding.v1" },
    "repository": { "type": "string", "pattern": "^[A-Za-z0-9_.-]+/[A-Za-z0-9_.-]+$" },
    "parent_issue": { "type": "integer", "minimum": 1 },
    "record_prefix": { "type": "string", "pattern": "^[A-Za-z0-9._-]{1,40}$" },
    "writer_prefix": { "type": "string", "pattern": "^[A-Za-z0-9._-]{1,40}$" },
    "store": {
      "type": "object",
      "additionalProperties": false,
      "required": ["kind", "repository", "branch", "path"],
      "properties": {
        "kind": { "enum": ["github"], "description": "The store backend. The only kind is github: a separate private repository written through the Contents API." },
        "repository": { "type": "string", "pattern": "^[A-Za-z0-9_.-]+/[A-Za-z0-9_.-]+$", "description": "A separate private repository; verified private and writable before every pass." },
        "branch": { "type": "string", "minLength": 1 },
        "path": { "type": "string", "pattern": "^([A-Za-z0-9_.-]+/)+$" }
      }
    },
    "required_checks": {
      "type": "array",
      "description": "Check names that count as required at the PR head, in addition to the checks GitHub marks required. With none of either, checks are never GREEN.",
      "items": { "type": "string", "minLength": 1 }
    },
    "dependency_updates": {
      "type": "object",
      "additionalProperties": false,
      "description": "How Dependabot updates are merged. Setting auto_merge to patch-minor is the owner's standing permission for this repository: Dependabot patch and minor updates merge (merge commit) once every required check passes, and only while the default branch requires at least one check. Major updates always wait for the owner.",
      "properties": {
        "auto_merge": { "enum": ["off", "patch-minor"], "description": "off (the default): every update waits for the owner. patch-minor: patch and minor updates merge on green." },
        "github_actions": { "enum": ["auto-merge", "owner"], "description": "With auto_merge patch-minor: auto-merge (the default) treats GitHub Actions updates like the rest; owner keeps them for the owner." }
      }
    },
    "projection": {
      "type": "object",
      "additionalProperties": false,
      "description": "Where the Programme Graph goes on the parent issue page. Without it, the graph goes under the title. Child pages always put their block under the title and its marked note.",
      "properties": {
        "after_section": { "type": "string", "minLength": 1, "description": "Heading text of the section the graph follows, for example CURRENT." },
        "replace_section": { "type": "string", "minLength": 1, "description": "Heading text of a hand-kept section the graph replaces when it is still on the page, for example Programme index. The section is removed in the same body write." }
      }
    }
  }
}
