{
  "schema": "toolkit.programme-binding.v1",
  "repository": "OWNER/REPOSITORY",
  "parent_issue": 0,
  "record_prefix": "INT-PREFIX-",
  "writer_prefix": "INT-PREFIX-",
  "store": {
    "kind": "github",
    "repository": "OWNER/EVIDENCE-STORE",
    "branch": "main",
    "path": "state/OWNER/REPOSITORY/"
  },
  "required_checks": ["validate"],
  "dependency_updates": {
    "auto_merge": "off",
    "github_actions": "auto-merge"
  }
}
